{
  "name": "subscription-center-rust",
  "category": "integration",
  "description": "KanIDM-OIDC-Anbindung (Authorization Code + PKCE) an subscriptionCenter für Axum-Services: Login, Gruppen→Rollen-Autorisierung und Session-Kill-Webhook. Additiv über die rust-Runtime.",
  "compatibleRuntimes": ["rust"],
  "requiresModules": ["axum"],
  "cargoDependencies": {
    "axum": "0.8",
    "tokio": { "version": "1", "features": ["macros", "rt-multi-thread"] },
    "reqwest": { "version": "0.12", "default-features": false, "features": ["json", "rustls-tls"] },
    "serde": { "version": "1", "features": ["derive"] },
    "serde_json": "1",
    "jsonwebtoken": "9",
    "sha2": "0.10",
    "base64": "0.22",
    "url": "2",
    "getrandom": "0.2",
    "tracing": "0.1"
  },
  "directories": [
    "src/auth",
    "docs"
  ],
  "requiredFiles": [
    "src/auth/mod.rs",
    "src/auth/config.rs",
    "src/auth/oidc.rs",
    "src/auth/session.rs",
    "src/auth/router.rs",
    "docs/subscription-center.md"
  ],
  "env": [
    "OPENID_ENABLED=true",
    "OPENID_ISSUER_URL=https://id.ch01.melchinger.net/oauth2/openid/CHANGE_ME",
    "OPENID_CLIENT_ID=CHANGE_ME",
    "OPENID_CLIENT_SECRET=CHANGE_ME",
    "OPENID_REDIRECT_URL=http://localhost:8080/auth/callback",
    "OPENID_SCOPES=openid email profile groups",
    "OPENID_ADMIN_GROUP=",
    "SESSION_SECRET=change-me-generate-a-random-32-byte-secret",
    "SESSION_KILL_SECRET=change-me-shared-with-subscriptioncenter"
  ],
  "detect": {
    "packageIndicators": ["jsonwebtoken"]
  }
}
