{
  "name": "tauri",
  "category": "desktop-shell",
  "description": "Cross-platform desktop shell with Rust core and web UI.",
  "compatibleRuntimes": ["rust"],
  "requiresModules": ["react"],
  "directories": [
    "src-tauri/src/commands",
    "src-tauri/src/application",
    "src-tauri/src/domain",
    "src-tauri/src/infrastructure"
  ],
  "requiredFiles": [
    "src-tauri/tauri.conf.json",
    "src-tauri/src/main.rs",
    "src-tauri/src/commands/mod.rs"
  ],
  "commands": [
    "desktop-dev: cargo tauri dev",
    "desktop-build: cargo tauri build"
  ]
}
